{
  "id": "microModule",
  "name": "Micro Module",
  "description": "The Micro dimmer and on/off modules, which run the KeypadLinc code base and take a sense line input from a wall switch.",
  "operatingFlags": [
    {
      "name": "programmingLock",
      "description": "Linking and programming from the device itself are locked out.",
      "query": "0x00",
      "bit": "0x01",
      "on": "0x00",
      "off": "0x01"
    },
    {
      "name": "ledOnTransmit",
      "description": "The status LED blinks when the device sends an Insteon message.",
      "query": "0x00",
      "bit": "0x02",
      "on": "0x02",
      "off": "0x03"
    },
    {
      "name": "resumeDim",
      "description": "Turning the load on at the device restores its last level instead of the on-level.",
      "query": "0x00",
      "bit": "0x04",
      "on": "0x04",
      "off": "0x05"
    },
    {
      "name": "ledOff",
      "description": "The status LEDs and button backlights are off.",
      "query": "0x00",
      "bit": "0x10",
      "on": "0x08",
      "off": "0x09"
    },
    {
      "name": "keyBeep",
      "description": "The device beeps when a button is pressed.",
      "query": "0x00",
      "bit": "0x20",
      "on": "0x0A",
      "off": "0x0B"
    },
    {
      "name": "radioOff",
      "description": "The device doesn't originate RF messages. It still repeats the RF messages it hears.",
      "query": "0x00",
      "bit": "0x40",
      "on": "0x0C",
      "off": "0x0D"
    },
    {
      "name": "powerLineOff",
      "description": "Insteon communication over the power line is off. The device turns it back on whenever it powers up.",
      "query": "0x00",
      "bit": "0x80",
      "on": "0x0E",
      "off": "0x0F"
    },
    {
      "name": "applicationRetries",
      "description": "The device retries application messages as many times as its link database says, and reports cleanup errors.",
      "query": "0x05",
      "bit": "0x01",
      "on": "0x10",
      "off": "0x11"
    },
    {
      "name": "x10Off",
      "description": "X10 sending and receiving are off.",
      "query": "0x05",
      "bit": "0x02",
      "on": "0x12",
      "off": "0x13"
    },
    {
      "name": "errorBlink",
      "description": "The status LED blinks when a communication error occurs.",
      "query": "0x05",
      "bit": "0x04",
      "on": "0x15",
      "off": "0x14"
    },
    {
      "name": "cleanupReport",
      "description": "The device sends a success report after the cleanup messages that follow a group command.",
      "query": "0x05",
      "bit": "0x08",
      "on": "0x17",
      "off": "0x16"
    },
    {
      "name": "checksumRequired",
      "description": "Extended Set and link database write messages must carry a checksum in D14.",
      "query": "0x05",
      "bit": "0x10",
      "on": "0x19",
      "off": "0x18"
    },
    {
      "name": "dualLine",
      "description": "The module has two sense lines. A dual sense line is always momentary.",
      "query": "0x06",
      "bit": "0x01",
      "on": "0x1F",
      "off": "0x1E"
    },
    {
      "name": "momentaryLine",
      "description": "The sense line input is momentary rather than latching.",
      "query": "0x06",
      "bit": "0x02",
      "on": "0x21",
      "off": "0x20"
    },
    {
      "name": "lineLevelSetsLoad",
      "description": "The sense line sets the load directly: line high turns it on and line low turns it off. When the bit is 0, every change of the line toggles the load, as a 3-way switch does.",
      "query": "0x06",
      "bit": "0x04",
      "on": "0x23",
      "off": "0x22"
    }
  ],
  "readings": [
    {
      "name": "databaseDelta",
      "description": "A count that goes up whenever the link database changes.",
      "query": "0x01"
    },
    {
      "name": "crcErrorCount",
      "description": "The number of messages received with a CRC error.",
      "query": "0x02"
    },
    {
      "name": "signalToNoiseFailureCount",
      "description": "The number of signal-to-noise failures.",
      "query": "0x03"
    }
  ],
  "flagCommands": [
    {
      "name": "smartHopsOn",
      "description": "Starts each message with the hop count of the last acknowledgment received (smart hops).",
      "command2": "0x1C"
    },
    {
      "name": "smartHopsOff",
      "description": "Starts each message with one hop.",
      "command2": "0x1D"
    },
    {
      "name": "yakityYakOff",
      "description": "Turns the Yakity Yak signaling option off.",
      "command2": "0x26"
    },
    {
      "name": "yakityYakOn",
      "description": "Turns the Yakity Yak signaling option on.",
      "command2": "0x27"
    },
    {
      "name": "modSyncFailureNoHop",
      "description": "When modulation sync fails, the device doesn't hop the message.",
      "command2": "0x28"
    },
    {
      "name": "modSyncFailureOwnZeroCrossing",
      "description": "When modulation sync fails, the device uses its own zero crossing.",
      "command2": "0x29"
    },
    {
      "name": "pushHopsToRadioOn",
      "description": "The device repeats every power line hop over RF.",
      "command2": "0x2A"
    },
    {
      "name": "pushHopsToRadioOff",
      "description": "The device doesn't repeat every power line hop over RF.",
      "command2": "0x2B"
    }
  ],
  "notes": [
    "Insteon's earliest command sheet swaps 0x08 and 0x09 (backlight on and off); the later sheets, used here, agree with the Insteon for Hub app.",
    "Insteon's 2009 Developer's Guide reads bit 4 of the 0x00 reply as LED on, but the later command sheets read it as LED off, the state 0x08 sets.",
    "Insteon's 2009 Developer's Guide gives query 0x02 as a signal-to-noise value; the later command sheets count messages with CRC errors there.",
    "Insteon's documents don't give this product's extended Get and Set layout."
  ],
  "sources": [
    "Insteon command workbook",
    "Insteon Developer's Guide (2009)",
    "Insteon for Hub app"
  ]
}
