{
  "id": "plugInModule",
  "name": "Plug-in Module",
  "description": "The 2632 plug-in dimmer and 2633 and 2635 plug-in on/off modules. The on/off modules ignore the ramp rate and on-level.",
  "operatingFlags": [
    {
      "name": "programmingLock",
      "description": "Linking and programming from the device itself are locked out.",
      "query": "0x00",
      "bit": "0x01",
      "on": "0x00",
      "off": "0x01"
    },
    {
      "name": "ledOnTransmit",
      "description": "The status LED blinks when the device sends an Insteon message.",
      "query": "0x00",
      "bit": "0x02",
      "on": "0x02",
      "off": "0x03"
    },
    {
      "name": "resumeDim",
      "description": "Turning the load on at the device restores its last level instead of the on-level.",
      "query": "0x00",
      "bit": "0x04",
      "on": "0x04",
      "off": "0x05"
    },
    {
      "name": "ledOff",
      "description": "The status LED is off.",
      "query": "0x00",
      "bit": "0x10",
      "on": "0x08",
      "off": "0x09"
    }
  ],
  "readings": [
    {
      "name": "databaseDelta",
      "description": "A count that goes up whenever the link database changes.",
      "query": "0x01"
    }
  ],
  "extendedSettings": {
    "perButton": false,
    "values": [
      {
        "name": "rampRate",
        "description": "The ramp rate, from 0x01 (8 minutes) to 0x1F (0.1 second). 0x00 is 2 seconds.",
        "byte": 7,
        "range": {
          "from": "0x00",
          "through": "0x1F"
        }
      },
      {
        "name": "onLevel",
        "description": "The level the load turns on to, from 0x00 (off) to 0xFF (full).",
        "byte": 8,
        "range": {
          "from": "0x00",
          "through": "0xFF"
        }
      },
      {
        "name": "ledBrightness",
        "description": "The brightness of the status LEDs, from 0x11 (dimmest) to 0x7F (brightest).",
        "byte": 9,
        "range": {
          "from": "0x11",
          "through": "0x7F"
        }
      }
    ],
    "writes": [
      {
        "name": "rampRate",
        "description": "Sets the ramp rate.",
        "selector": "0x05",
        "perButton": false,
        "bytes": [
          {
            "position": 3,
            "value": "rampRate"
          }
        ]
      },
      {
        "name": "onLevel",
        "description": "Sets the on-level.",
        "selector": "0x06",
        "perButton": false,
        "bytes": [
          {
            "position": 3,
            "value": "onLevel"
          }
        ]
      },
      {
        "name": "ledBrightness",
        "description": "Sets the brightness of the status LED.",
        "selector": "0x07",
        "perButton": false,
        "bytes": [
          {
            "position": 3,
            "value": "ledBrightness"
          }
        ]
      }
    ]
  },
  "notes": [
    "The product requirements documents list bit 5 of the 0x00 reply as load sense, which Insteon's command sheets give as the key beep on the KeypadLinc code base, and document no command that sets it."
  ],
  "sources": [
    "Insteon command workbook",
    "Insteon product requirements document for the 2632",
    "Insteon product requirements document for the 2633"
  ]
}
